categoryName;englishName;humanFormat;populate;visible;generalizations;mutexExceptions;knownNegatives;instanceType;seedInstances;seedExtractionPatterns;conceptSynonyms;queryString;editDate;author;curator;description;freebaseID;comment;
everyPromotedThing;;%s is {something};FALSE;FALSE;;;;all;;;;todas promoções;2014-10-31;Maísa Duarte;Maísa Duarte;every promoted category instance in KB;;;
abstractThing;;%s is an {abstract thing};FALSE;FALSE;everyPromotedThing;;;all;;;;abstrato;2014-10-31;Maísa Duarte;Maísa Duarte;"thought, quality, characteristic apart from concrete realities, specific objects, or actual instances; theoretical, not applied or practical (http://dictionary.reference.com/browse/abstract)";;;
campoAcadêmico;academic fields;%s is an {academic field};TRUE;TRUE;abstractThing;questõesPolíticas setorEconômico;;all;"""Astronomia"" ""Biologia"" ""Literatura Comparada"" ""Ciência da Computação"" ""Economia"" ""Ciências Ambientais"" ""Geologia"" ""Históra"" ""Linguística"" ""Matemática"" ""Filosofia"" ""Física"" ""Psicologia"" ""Sociologia"" ""Artes Cênicas""";"""_ é um campo acadêmico"" ""_ é o campo acadêmico"" ""_ é um dos campos acadêmicos"" ""_ campo acadêmico conhecido como"" "" campo acadêmico conhecido como _"" "" campo acadêmico chamado de _"" "" campo acadêmico apelidado de _"" ""_ é um curso acadêmico"" ""_ é o curso acadêmico"" ""_ é um dos cursos acadêmicos"" ""_ curso acadêmico conhecido como"" "" curso acadêmico conhecido como _"" "" curso acadêmico chamado de _"" "" curso acadêmico apelidado de _"" ""_ é uma área acadêmica"" ""_ é a área acadêmica"" ""_ é uma das áreas acadêmicas"" ""_ área acadêmica conhecida como"" ""área acadêmica conhecida como _"" ""área acadêmica chamada de _"" ""área acadêmica apelidada de _"" ""área acadêmica tais como _"" ""áreas acadêmicas tais como _"" ""área acadêmica como _"" ""áreas acadêmicas como _"" ""cursos da área de _"" ""cursos de _ "" ""curso de _ "" ""área acadêmica de _"" ""curso acadêmico de _""";;campo acadêmico;2014-10-31;Maísa Duarte;Maísa Duarte;A field of study is the field, area, or discipline which is the focus of study of a student or academic, or which is taught in a school.;/education/field_of_study;Translated;
ator;actors;%s is an {actor};TRUE;TRUE;pessoa;masculino atleta pessoaPorLocalidade diretorDeCinema comediante feminino modelo celebridade professor;;proper;" ""Regina Duarte"" ""Carolina Dieckmann"" ""Tony Ramos"" ""Giovanna Antonelli"" ""Mateus Solano"" ""Brad Pitt"" ""Cauã Reymond"" ""Angelina Jolie"" ""Giovanna Lancellotti"" ""Lázaro Ramos"" ""Bruna Marquezine"" ""Stênio Garcia"" ""Gabriel Braga"" ""Paola Oliveira"" ""Tarcisio Meira""";"""_ é um ator"" ""_ é o ator"" ""_ é um dos atores"" ""_ ator conhecido como"" ""ator conhecido como _"" ""ator chamado de _"" ""ator apelidado de _"" ""_ é uma atriz"" ""_ é a atriz"" ""_ é uma das atrizes"" ""_ atriz conhecida como"" ""atriz conhecida como _"" ""atriz chamada de _"" ""atriz apelidada de _"" ""atriz tais como _"" ""atrizes tais como _"" ""atores tais como _"" ""atriz como _"" ""atores como _"" ""atrizes como _""";;ator;2014-10-31;Maísa Duarte;Maísa Duarte;An actor is a person who performs in movies, television, plays, or other forms of entertainment.;;Removed some names and added brazilian names;
agent;;%s is an {agent};FALSE;FALSE;everyPromotedThing;;;all;;;;agente;2014-10-31;Maísa Duarte;Maísa Duarte;"a person or business authorized to act on another's behalf; a person or thing that acts or has the power to act; a natural force or object producing or used for obtaining specific results (http://dictionary.reference.com/browse/agent), and more generally, anything that can exhibit agency, such as non-human life forms.";;;
produtoAgrícola;agricultural products;%s is an {agricultural product};TRUE;TRUE;item;castanha legume cereal fruta vegetal carne animal bebida;"""cães"" ""gatos"" ""soda""";all;"""trigo"" ""milho"" ""soja"" ""leite"" ""algodão"" ""lã"" ""cânhamo"" ""seda"" ""linho"" ""gado"" ""porcos"" ""legumes"" ""arroz"" ""flores"" ""produtos lácteos"" ""queijo"" ""feijão"" ""amendoim"" "" madeira"" ""café"" ""açúcar"" ""cacau""";"""_ é um produto agrícola"" ""_ é o produto agrícola"" ""_ é um dos produtos agrícolas"" ""_ produto agrícola conhecido como"" "" produto agrícola conhecido como _"" "" produto agrícola chamado de _"" "" produto agrícola apelidado de _"" ""_ é um produto rural"" ""_ é o produto rural"" ""_ é um dos produtos rurais"" ""_ produto rural conhecido como"" ""produto rural conhecido como _"" "" produto rural chamado de _"" ""produto rural apelidado de _"" ""produtos rurais tais como _"" ""produtos rurais como _"" ""produtos agrícolas como _"" ""produto agrícola como _""  ""produtos agrícolas tais como _"" ""produto agrícola tais como _"" ";;produto agrícola;2014-10-31;Maísa Duarte;Maísa Duarte;a living thing (or something derived therefrom) which is specifically cultivated and produced to sustain or enrich life;none;Translated;
aeroporto;airports;%s is an {airport};TRUE;TRUE;construção;;;proper;"""Área 51"" ""Aeroporto Internacional de Guarulhos"" ""Aeroporto Internacional Tancredo Neves"" ""Aeroporto Internacional de Los Angeles"" ""Aeroporto Internacional de Amsterdã Schiphol"" ""Aeroporto Estadual Dr. Leite Lopes"" ""Aeroporto de Frankfurt"" ""Aeroporto Internacional John F. Kennedy"" ""Aeroporto Internacional de Atenas"" ""Aeroporto Internacional Salgado Filho"" ""Aeroporto Internacional Galeão"" ""Aeroporto Internacional de Viracopos–Campinas""";"""_ é um aeroporto"" ""mau tempo fecha _"" ""pouso e decolagem no _"" ""_  aeroporto mais movimentado""  ""vai desembarcar no aeroporto _"" ""desembarcou no _"" ""embarcou no aeroporto _"" ""terminal 2 do _"" ""terminal 1 do _"" ""o aeroporto _"" ""mau tempo fecha _"" ""TAM no Aeroporto _"" ""TAM retornou ao _"" ""avião retornou ao _"" ""sede do Aeroporto _"" ""região do Aeroporto _"" ""última decolagem em _"" ""_ é o aeroporto"" ""é o aeroporto _"" ""aeroporto conhecido como _"" ""aeroporto chamado de _"" ""aeroporto apelidado de _"" ""_ é um dos aeroportos"" ""aeroportos tais como _"" ""aeroportos assim como _"" ""aeroportos como _"" ""aeroporto tal como _"" ""aeroporto assim como _"" ""aeroporto como _""";;aeroporto;2014-10-31;Maísa Duarte;Maísa Duarte;"""A place where airplanes, helicopters, or other flying vehicles land and take off""";/aviation/airport;Removed almost all and added brazilian names;
anfíbio;amphibians;%s is an {amphibian};TRUE;TRUE;vertebrado;;;common;" ""sapo"" ""salamandra"" ""cobra-cega"" ""perereca verde"" ""rã"" ""sapo cururu"" ""filomedusa"" ""rã da floresta"" ""enguia"" ""tritão"" ""proteu"" ""perereca da taboa"" ""perereca de vidro"" ""salamandra de fogo"" ""sereia""";"""_ é um anfíbio"" ""_ é o anfíbio"" ""_ é um dos anfíbios"" "" anfíbio conhecido como _"" ""anfíbio chamado de _"" ""anfíbio apelidado de _"" ""anfíbios tais como _"" ""anfíbios assim como _"" ""anfíbios como _""";;anfíbio;2014-10-31;Maísa Duarte;Maísa Duarte;"Amphibians (class Amphibia, from Amphi- meaning ""on both sides"" and -bios meaning ""life""), such as frogs, salamanders, and caecilians, are ectothermic (or cold-blooded) animals that metamorphose from a juvenile water-breathing form, either to an adult air-breathing form, or to a paedomorph that retains some juvenile characteristics.";none;Translated, removed some names and added brazilian names;
animal;animals;%s is an {animal};TRUE;TRUE;agent espécies;produtoAgrícola;;common;"""formigas"" ""caranguejos"" ""brontossauros"" ""corujas"" ""abelhas"" ""pássaros"" ""vermes"" ""caracóis"" ""esquilos"" ""baleias"" ""vespas"" ""golfinhos"" ""girafas"" ""rinocerontes"" ""tubarões""";"""_ é um animal"" ""_ é o animal"" ""animal conhecido como _"" ""animal chamado de _"" ""animal apelidado de _"" ""_ é um dos animais"" ""animais tais como _"" ""animais assim como _"" ""animais como _"" ""animal tal como _"" ""animal assim como _"" ""animal como _""";;animal;2014-10-31;Maísa Duarte;Maísa Duarte;A collection of common-sense animals, more understandable to children than biologists.  It's OK to include both general kinds of animals, such as bird, but also common varieties of birds such as finch and robin. (FreeBase)  As with plant, any mortal action upon an animal or action on a dead animal that results in something with a new name (e.g. milking, shearing, slaughtering, or cooking it) results in something that is no longer an animal.;/biology/animal;Translated;
aquário;aquariums;%s is an {aquarium};TRUE;TRUE;atração;parque zoológico;;proper;"""Aquário de Vancouver"" ""Aquário de Georgia"" ""Aquário de Okinawa Churaumi"" ""Aquário de Melbourne"" ""Aquário de Génova"" ""Aquário de Sydney"" ""Aquário de Nova Iorque""";"""_ é um aquário"" ""_ é o aquário"" ""é o aquário _"" ""aquário conhecido como _"" ""aquário chamado de _"" ""aquário apelidado de _"" ""_ é um dos aquários"" ""aquários tais como _"" ""aquários assim como _"" ""aquários como _"" ""aquário tal como _"" ""aquário assim como _"" ""aquário como _""";;aquático;2014-10-31;Maísa Duarte;Maísa Duarte;the aquatic counterpart of a zoo, housing living aquatic species for viewing;"not present in Freebase; Source: http://en.wikipedia.org/wiki/Public_aquarium";Translated;
aracnídeo;arachnids;%s is an {arachnid};TRUE;TRUE;artrópode;;;common;"""escorpião""  ""aranha violino"" ""aranha marrom"" ""pseudo-escorpião"" ""aranha"" ""carrapato"" ""viúva-negra"" ""aranha armadeira"" ""schizomida"" ""opiliões""";"""_ é um aracnídeo"" ""_ é o aracnídeo"" ""é o aracnídeo _"" ""aracnídeo conhecido como _"" ""aracnídeo chamado de _"" ""aracnídeo apelidado de _"" ""_ é um dos aracnídeos"" ""_ é uma aranaha"" ""_ é a aranha"" ""aranha conhecida como _"" ""aranha chamada de _"" ""aranha apelidada de _"" ""_ é uma das aranhas"" ""aranhas tais como _"" ""aranhas assim como _"" ""aranhas como _"" ""aranha tal como _"" ""aranha assim como _"" ""aranha como _"" ""aracnídeos tais como _"" ""aracnídeos assim como _"" ""aracnídeos como _"" ""aracnídeo tal como _"" ""aracnídeo assim como _"" ""aracnídeo como _""";;aracnídeo;2014-10-31;Maísa Duarte;Maísa Duarte;air-breathing arthropods characterized by simple eyes and four pairs of legs;none;Translated, removed some names and added brazilian names;
arquea ;archaea;%s is an {archaeon};TRUE;TRUE;espécies;;;common;" ""Nanoarchaeum equitans"" ""Nanoarchaeota"" ""Halobacteria"" ""Crenarchaeota"" ""Korarchaeota"" ""Euryarchaeota"" ""Thermoprotei"" ""Archaeoglobaceae"" ""Archaeoglobus"" ""Archaeoglobales"" ""Ferroglobus"" ""Methanopyri""";"""_ é uma arquea"" ""_ é a arquea"" ""arquea conhecida como _"" ""arquea chamada de _"" ""arquea apelidada de _"" ""_ é uma das arqueas"" ""arqueas tais como _"" ""arqueas assim como _"" ""arqueas como _"" ""arquea tal como _"" ""arquea assim como _"" ""arquea como _""";;arquea ;2014-10-31;Maísa Duarte;Maísa Duarte;single-celled organisms lacking nuclei, formerly called archaebacteria but now known to differ fundamentally from bacteria;none;Translated;
arquiteto;architects;%s is an {architect};TRUE;TRUE;pessoa;artistaDeArteVisual masculino feminino celebridade cientista pessoaPorLocalidade professor;;proper;"""Alejandro Bustillo"" ""Cláudio Rossi"" ""Baldassarre Longhena"" ""François Mansart"" ""Attilio Corrêa Lima"" ""Oscar Niemeyer"" ""Senemut"" ""Alvar Aalto"" ""Louis Kahn"" ""Antoni Gaudí "" ""Norman Foster"" ""Arata Isozaki"" ""André Piva"" ""Ary Perez"" ""Elisário Bahiana"" ""Lúcio Costa"" ""Nora Tausz Rónai"" ""Carlos Porto"" ""Jaime Cezário""";"""projetos de arquitetos como _"" ""arquitetos como _"" ""arquitetos consagrados, como _"" ""arquitetos consagrados como _"" ""_ projetou a construção"" ""_ foi um pintor e arquiteto"" ""_ foi um arquiteto"" ""_ was an argentine painter and architect"" ""_ was a architect""  ""_  é um arquiteto brasileiro"" ""_ projetou os principais prédios"" ""o arquiteto britânico _"" ""a estrela da arquitetura _"" ""a obra da arquiteta _"" ""a obra do arquiteto _"" ""o parque foi projeto por _"" ""arquiteto da equipe de _"" ""_ arquiteto da equipe de"" ""_ é um arquiteto"" ""_ é o arquiteto"" ""é o arquiteto _"" ""arquiteto conhecido como _"" ""arquiteto chamado de _"" ""arquiteto apelidado de _"" ""_ é um dos arquitetos"" ""_ é uma arquiteta"" ""_ é a arquiteta"" ""arquiteta conhecida como _"" ""arquiteta chamada de _"" ""arquiteta apelidada de _"" ""_ é uma das arquitetas"" ""arquitetas tais como _"" ""arquitetas assim como _"" ""arquitetas como _"" ""arquiteta tal como _"" ""arquiteta assim como _"" ""arquiteta como _"" ""arquitetos tais como _"" ""arquitetos assim como _"" ""arquiteto tal como _"" ""arquiteto assim como _"" ""arquiteto como _""";;arquiteto;2014-10-31;Maísa Duarte;Maísa Duarte;"""a person who designs buildings or other structures""";/architecture/architect;Removed some names and added brazilian names;
artéria;arteries;%s is an {artery};TRUE;TRUE;parteDoCorpo;;;all;""" artéria renal"" ""artéria braquial"" ""artéria inominada"" ""artéria femoral"" ""artéria femoral profunda"" ""círculo de willis"" ""artéria subclávia"" ""artéria carótida externa"" ""arteríolas"" ""artéria pulmonar"" ""artéria carótida interna"" ""artéria radial""";"""_ é uma artéria"" ""_ é a artéria"" ""artéria conhecida como _"" ""artéria chamada de _"" ""artéria apelidada de _"" ""_ é uma das artéria"" ""artérias tais como _"" ""artérias como _"" ""artéria tal como _"" ""artéria como _""";;artéria;2014-10-31;Maísa Duarte;Maísa Duarte;"""Arteries are muscular blood vessels that carry blood away from the heart.""";/medicine/artery;Translated;
artrópode;arthropods;%s is an {arthropod};TRUE;TRUE;invertebrado;;;common;"""formigas"" ""abelhas"" ""vermes de veludo"" ""caranguejos"" ""aranhas"" ""escorpiões"" ""centopéias"" ""lacraia"" ""borboletas"" ""moscas"" ""besouros"" ""vespas"" ""trilobites"" ""piolhos"" ""lagostas""";"""_ é um artrópode"" ""_ é o artrópode"" ""é o artrópode _"" ""artrópode conhecido como _"" ""artrópode chamado de _"" ""artrópode apelidado de _"" ""_ é um dos artrópodes""  ""_ é uma artrópode"" ""_ é a artrópode"" ""artrópode conhecida como _"" ""artrópode chamada de _"" ""artrópode apelidada de _"" ""_ é uma das artrópodes"" ""artrópodes tais como _"" ""artrópodes assim como _"" ""artrópodes como _"" ""artrópode tal como _"" ""artrópode assim como _"" ""artrópode como _""";;artrópode;2014-10-31;Maísa Duarte;Maísa Duarte;Arthropods are members of the phylum Arthropoda.;none;Translated;
astronauta;astronauts;%s is an {astronaut};TRUE;TRUE;pessoa;masculino feminino celebridade pessoaPorLocalidade professor político;;proper;" ""Catherine Coleman"" ""Charles Edward Jones"" ""Harrison Schmitt"" ""Neil Armstrong"" ""Tamara E. Jernigan"" ""Yuri Gagarin"" ""Roger B. Chaffee"" ""Edward Higgins White"" ""Gus Grissom"" ""Toktar Aubakirov"" ""Elliot See"" ""Sonny Carter""";"""_ é um astronauta"" ""_ é o astronauta"" ""é o astronauta _"" ""astronauta conhecido como _"" ""astronauta chamado de _"" ""astronauta apelidado de _"" ""_ é um dos astronautas"" ""_ é uma astronauta"" ""_ é a astronauta"" ""astronauta conhecida como _"" ""astronauta chamada de _"" ""astronauta apelidada de _"" ""_ é uma das astronautas"" ""astronautas tais como _"" ""astronautas assim como _"" ""astronautas como _"" ""astronauta tal como _"" ""astronauta assim como _"" ""astronauta como _"" ""o vôo orbital de _"" ""_ fincava a bandeira norte-americana"" ""_ deixou a primeira pegada humana"" ""o cosmonauto _"" ""_ faz o primeiro vôo orbital"" ""o astronauta americano _"" ""o astronauta soviético _"" ""o spaceman soviético _ "" ""o spaceman _"" ""o astronauta _"" ""_ durante uma atividade no espaço"" ""o taikonauta _"" ""o espaçonauta _"" ""o cosmonauta _"" ""_ viu a Terra do espaço"" ""_ foi a primeira cosmonauta"" ""americana no espaço _ "" ""_ astronauta brasileiro"" ""_ astronauta americano"" ""_ astronauta russo""";;astronauta;2014-10-31;Maísa Duarte;Maísa Duarte;An astronaut is a person that has flown in outer space. Not used for animals sent to space experimentally.;/spaceflight/astronaut;No changes;
atleta;athletes;%s is an {athlete};TRUE;TRUE;pessoa;masculino feminino celebridade pessoaPorLocalidade ator treinador;;proper;" ""Alex Rodriguez"" ""Bebeto"" ""David Luiz"" ""Marcos Rocha"" ""Paolo Guerrero"" ""Neymar"" ""Vampeta"" ""Pelé"" ""Ronaldinho Gaúcho"" ""Ronaldo Fenômeno"" ""Raí"" ""Marta Vieira"" ""Fernando Scherer"" ""Gustavo Borges"" ""Ramires"" ""Bernard"" ""Fred"" ""Hulk"" ""Paulinho""";"""_ é um atleta"" ""_ é o atleta"" ""é o atleta _"" ""atleta conhecido como _"" ""atleta chamado de _"" ""atleta apelidado de _"" ""atleta tal como _"" ""atleta assim como _"" ""atleta como _"" ""_ é um dos atletas"" ""_ é uma atleta"" ""_ é a atleta"" ""atleta conhecida como _"" ""atleta chamada de _"" ""atleta apelidada de _"" ""atleta tais como _"" ""atleta assim como _"" ""atleta como _"" ""_ é uma das atletas"" ";{“Ken Griffey , Jr .”, “Ken Griffey Jr”} {“O.J. Simpson”, “O . J . Simpson”} {“Robert Trent Jones , Jr .”, “Robert Trent Jones Jr”} {“Arnold Palmer”, “legendary Arnold Palmer”} {“Cabell Robinson”, “Cabell B . Robinson”} {“catcher Ivan Rodriguez”, “Ivan Rodriguez”} {“Herrera Craig Brazell”, “Craig Brazell”} {“Luis G Rivera”, “Luis Rivera”} {“Marion Barber III”, “Marion Barber”} {“Mr. Travis Tobaben”, “Travis Tobaben”};atleta;2014-10-31;Maísa Duarte;Maísa Duarte;An athlete is a person who plays a sport competitively.;/sports/pro_athlete;Removed some names and added brazilian names;
atração;tourist attractions;%s is a {tourist attraction};TRUE;TRUE;localização;construção caverna lago montanha praia ilha rio trilha fazenda;;proper;"""Estátua da Liberdade"" ""Museu do Louvre"" ""Museu Picasso de Barcelona"" ""Museu Aeroespacial de Washington"" ""Museu TAM"" ""Museu de Arte Moderna da Bahia"" ""Observatório Astronómico de Lisboa"" ""Observatório Nacional"" ""Cristo Redentor"" ""Pão de Açúcar"" ""Museu de Arte de São Paulo"" ""Parque Nacional do Iguaçu"" ""Praia de Copacabana"" ""Chapada dos Veadeiros"" ""Parque Nacional do Itatiaia"" ""Igreja do Bonfim"" ""Catedral da Sé"" ""Museu de Arte da Pampulha"" ""Museu da Mineralogia"" ""Serra da Mantiqueira"" ""Parque do Ibirapuera"" ""Montanhas Cafeeiras de Minas"" ""Parque Nacional da Serra da Capivara"" ""Pelourinho"" ""Pantanal"" ""Lençóis Maranhenses"" ""Museu Pierre Chalita"" ""Museu Afro-brasileiro"" ""Fundação Casa de Jorge Amado"" ""Mercado Modelo"" ""Farol da Barra"" ""Arquipélago de Fernando de Noronha"" ""Museu da Língua Portuguesa"" ""Museu do Futebol"" ""Museu de Arte de São Paulo Assis Chateaubriand"" ""Museu de Arte Sacra"" ""Basílica de São Bento"" ""Centro Cultural Banco do Brasil"" ""Memorial JK"" ""Praça dos Três Poderes""";"""_ é uma atração"" ""_ é a atração"" ""atração conhecida como _"" ""atração chamada de _"" ""atração apelidada de _"" ""atrações tais como _"" ""atrações assim como _"" ""atrações como _"" ""_ é uma das atrações"" ""_ é uma atração turística"" ""_ é a atração turística"" ""atração turística conhecida como _"" ""atração turística chamada de _"" ""atração turística apelidada de _"" ""atrações turísticas tais como _"" ""atrações turísticas assim como _"" ""atrações turísticas como _"" ""atrações tais como _"" ""atrações assim como _"" ""atrações como _"" ""atração turística tal como _"" ""atração turística assim como _"" ""atração turística como _"" ""_ é uma das atrações turísticas"" ";;atração;2014-10-31;Maísa Duarte;Maísa Duarte;sight or feature that you might visit as a tourist. Examples include monuments, parks, museums, and the like. This type includes Location, which means it is usually used for things which are themselves locations (like those described above;/travel/tourist_attraction;Removed almost all and added brazilian names;
motorDeAutomóvel;automobile maker;%s is a kind of {automobile engine};TRUE;TRUE;produto;;;proper;" ""Ford FE engine"" ""Ford 385 engine"" ""Ford Zetec engine"" ""Ford Duratec engine"" ""Ford 335 engine"" ""Ford Boss 302 engine"" ""Ford Windsor engine"" ""Ford Y-block engine"" ""Northstar engine series"" ""Chrysler Slant-6 engine"" ""Tritec engine"" ""Chrysler Flathead engine""";"""_ é um motor de automóvel"" ""_ é o motor de automóvel"" ""é o motor de automóvel _"" ""motor de automóvel conhecido como _"" ""motor de automóvel chamado de _"" ""motor de automóvel apelidado de _"" ""motor de automóvel tal como _"" ""motor de automóvel assim como _"" ""motor de automóvel como _"" ""_ é um dos motores de automóvel"" ""motores de automóvel tais como _"" ""motores de automóvel assim como _"" ""motores de automóvel como _"" ""_ é um motor de carro"" ""_ é o motor de carro"" ""é o motor de carro _"" ""motor de carro conhecido como _"" ""motor de carro chamado de _"" ""motor de carro apelidado de _"" ""motor de carro tal como _"" ""motor de carro assim como _"" ""motor de carro como _"" ""_ é um dos motores de carro"" ""motores de carro tais como _"" ""motores de carro assim como _"" ""motores de carro como _""";;motor de automóvel;2014-10-31;Maísa Duarte;Maísa Duarte;The engine type is to be used to classify specific powerplants used in an automobile. These may be year-specific, but more frequently they often span multiple years, models, makes and generations.;/automotive/engine;No changes;
fabricanteDeAutomóvel;automobile maker;%s is an {automobile manufacturer};TRUE;TRUE;empresa;;;proper;" ""Ford"" ""Honda"" ""Nissan"" ""Toyota"" ""SAAB"" ""Chevrolet"" ""Satrun"" ""General Motors"" ""Volvo"" ""Fiat"" ""Peugeot""";"""_ é um fabricante de automóvel"" ""_ é o fabricante de automóvel"" ""é o fabricante de automóvel _"" ""fabricante de automóvel conhecido como _"" ""fabricante de automóvel chamado de _"" ""fabricante de automóvel apelidado de _"" ""fabricante de automóvel tal como _"" ""fabricante de automóvel assim como _"" ""fabricante de automóvel como _"" ""_ é um dos fabricantes de automóvel"" ""fabricantes de automóvel tais como _"" ""fabricantes de automóvel assim como _"" ""fabricantes de automóvel como _"" ""_ é um fabricante de  carro"" ""_ é o fabricante de carro"" ""é o fabricante de  carro _"" ""fabricante de carro conhecido como _"" ""fabricante de carro chamado de _"" ""fabricante de carro apelidado de _"" ""fabricante de carro tal como _"" ""fabricante de carro assim como _"" ""fabricante de carro como _"" ""_ é um dos fabricantes de carro"" ""fabricantes de carro tais como _"" ""fabricantes de carro assim como _"" ""fabricantes de carro como _""";;fabricante de automóvel;2014-10-31;Maísa Duarte;Maísa Duarte;A company that manufactures motor-powered vehicles (eg., cars, motorcycles, buses, trucks and motorized bikes);/automotive/company;No changes;
modeloDeAutomóvel;car models;%s is a {model of automobile};TRUE;TRUE;veículo;;;proper;" ""Corolla"" ""Pálio"" ""Impala"" ""F250"" ""UNO"" ""Passat"" ""Fiesta"" ""Gol"" ""Focus"" ""Fox"" ""Fit"" ""Civic""";"""_ é um modelo de automóvel"" ""_ é o modelo de automóvel"" ""é o modelo de automóvel _"" ""modelo de automóvel conhecido como _"" ""modelo de automóvel chamado de _"" ""modelo de automóvel apelidado de _"" ""modelo de automóvel tal como _"" ""modelo de automóvel assim como _"" ""modelo de automóvel como _"" ""_ é um dos modelos de automóveis"" ""modelos de automóveis tais como _"" ""modelos de automóveis assim como _"" ""modelos de automóveis como _"" ""_ é um modelo de carro"" ""_ é o modelo do carro"" ""é o modelo de automóvel _"" ""modelo do carro conhecido como _"" ""modelo do carro chamado de _"" ""modelo do carro apelidado de _"" ""modelo do carro tal como _"" ""modelo do carro assim como _"" ""modelo do carro como _"" ""_ é um dos modelos de carro"" ""modelos de carro tais como _"" ""modelos de carro assim como _"" ""modelos de carro como _""";;modelo de automóvel;2014-10-31;Maísa Duarte;Maísa Duarte;A model is a specific car carried under a make.;/automotive/model;Removed some names and added brazilian names;
campeonato;championships;%s is an {award, championship, or tournament trophy};TRUE;TRUE;abstractThing;;;all;"""Copa do Mundo"" ""Campeonato Brasileiro de Futebol"" ""Olimpíadas"" ""Super Bowl"" ""Grande Prêmio de Abu Dhabi"" ""Grande Prêmio de Mônaco"" ""Fórmula Indy"" ""Fórmula Truck"" ""Grande Prêmio da Alemanha"" ""Campeonato NBA"" ""Copa das Confederações da FIFA"" ""Taça Davis"" ""Copa Sudamericana"" ""Taça Federação Portuguesa de Futebol"" ""Taça da Liga Inglesa de Futebol""";"""_ é um campeonato"" ""_ é o campeonato"" ""é o campeonato _"" ""campeonato conhecido como _"" ""campeonato chamado de _"" ""campeonato apelidado de _"" ""_ é um dos campeonatos""  ""campeonato tal como _"" ""campeonato assim como _"" ""campeonato como _"" ""campeonatos tais como _"" ""campeonatos assim como _"" ""campeonatos como _"" ""_ é um torneio"" ""_ é o torneio"" ""é o torneio _"" ""torneio conhecido como _"" ""torneio chamado de _"" ""torneio apelidado de _"" ""_ é um dos torneios"" ""torneio tal como _"" ""torneio assim como _"" ""torneio como _"" ""torneios tais como _"" ""torneios assim como _"" ""torneios como _""";;campeonato;2014-10-31;Maísa Duarte;Maísa Duarte;Sports award is a CVT which connects together the winner of a sports award, the award they won, the season for which they won the award and the team they represented (if applicable).;/sports/sports_championship;Removed almost all and added brazilian names;
