categoryName;englishName;humanFormat;populate;visible;generalizations;mutexExceptions;knownNegatives;instanceType;seedInstances;seedExtractionPatterns;conceptSynonyms;queryString;editDate;author;curator;description;freebaseID;comment;
partidoPolítico;political parties;%s is a {political party};TRUE;TRUE;organizaçãoNãoGovernamental;;;proper;"""Democratic Party"" ""Republican Party"" ""Green Party"" ""Libertarian Party"" ""Indian National Congress"" ""BJP"" ""Left Party"" ""Labour Party"" ""RJD"" ""Socialist Democratic Party""  ""BSP"" ""Liberal Party""";"""_ é um partido político"" ""_ é o partido político"" ""é o partido político _"" ""partido político conhecido como _"" ""partido político chamado de _"" ""partido político apelidado de _"" ""_ é um dos partidos políticos"" ""_ são partidos políticos"" ""_ são os partidos políticos"" ""partidos políticos conhecidos como _"" ""partidos políticos chamados de _"" ""partidos políticos apelidados de _"" ""_ são alguns dos partidos políticos""  ""partidos políticos tais como _"" ""partidos políticos assim como _"" ""partidos políticos como _"" ";;festa política;2014-10-31;Maísa Duarte;Maísa Duarte;organized political group that primarily aims for the attainment of political power and public office for its designated members.;/government/political_party;Dúvida;
político;politicians;%s is a {politician};TRUE;TRUE;pessoa;masculino feminino pessoaPorLocalidade celebridade professor monarca astronauta;;proper;"""Luiz Inácio Lula da Silva"" ""José Serra"" ""ACM Neto"" ""Hugo Chávez"" ""Celso Pitta"" ""Celso Russomano"" ""Fernando Collor"" ""Enéas Carneiro"" ""Alckmin"" ""César Maia"" ""Dilma""";"""_ é um  político"" ""_ é o  político"" ""é o  político _"" ""político conhecido como _"" ""político chamado de _"" ""político apelidado de _"" ""_ é um dos  políticos"" ""_ são  políticos"" ""_ são os  políticos"" ""políticos conhecidos como _"" ""políticos chamados de _"" ""políticos apelidados de _"" ""_ são alguns dos  políticos""  ""políticos tais como _"" ""políticos assim como _"" ""políticos como _""";;político;2014-10-31;Maísa Duarte;Maísa Duarte;"Any person who has held or sought a position in a government.  The term ""politician"" may not be strictly accurate for some positions such as kings, but we have to call it something!";/government/politician;Removed all and added others names;
políticoDosUSA;American politicians;%s is a {U.S. politician};TRUE;TRUE;pessoaDosUSA político;;;proper;"""Barack Obama""  ""Barbara Boxer"" ""Barney Frank"" ""Harry Reid"" ""Hillary Clinton"" ""Jimmy Carter"" ""John McCain"" ""Joe Biden"" ""Luke Ravenstahl"" ""Ed Rendell"" ""George W . Bush""  ""Mitt Romney""";"""_ é um político dos Estados Unidos"" ""_ é o político dos Estados Unidos"" ""é o político dos Estados Unidos _"" ""político dos Estados Unidos conhecido como _"" ""político dos Estados Unidos chamado de _"" ""político dos Estados Unidos apelidado de _"" ""_ é um dos políticos dos Estados Unidos"" ""_ são políticos dos Estados Unidos"" ""_ são os políticos dos Estados Unidos"" ""políticos dos Estados Unidos conhecidos como _"" ""políticos dos Estados Unidos chamados de _"" ""políticos dos Estados Unidos apelidados de _"" ""_ são alguns dos políticos dos Estados Unidos"" ""políticos dos Estados Unidos tais como _"" ""políticos dos Estados Unidos assim como _"" ""políticos dos Estados Unidos como _"" ""_ é um político americano"" ""_ é o político americano"" ""é o político americano _"" ""político americano conhecido como _"" ""político americano chamado de _"" ""político americano apelidado de _"" ""_ é um dos políticos americanos"" ""_ são políticos americanos"" ""_ são os políticos americanos"" ""políticos americanos conhecidos como _"" ""políticos americanos chamados de _"" ""políticos americanos apelidados de _"" ""_ são alguns dos políticos americanos"" ""políticos americanos tais como _"" ""políticos americanos assim como _"" ""políticos americanos como _""";;político dos USA;2014-10-31;Maísa Duarte;Maísa Duarte;Politicians of the U.S.A;;No changes;
contaPolítica;legislations;%s is a {legislative bill};TRUE;TRUE;abstractThing;;;proper;"""Climate Stewardship Act"" ""1964 Civil Rights Act"" ""American With Disabilities Act"" ""Health Insurance Portability and Accountability Act"" ""Social Security Act"" ""Sarbanes-Oxley Act"" ""Genetic Information Nondiscrimination Act"" ""Homeland Security Act"" ""PATRIOT Act"" ""Patient Safety and Quality Improvement Act"" ""Public Health Security and Bioterrorism Preparedness and Response Act"" ""Educational Rights and Privacy Act""";;;conta política;2014-10-31;Maísa Duarte;Maísa Duarte;A legislative bill, passed, enacted, or otherwise.;none;;
blogPolítico;political blogs;%s is a {political blog};TRUE;TRUE;blog;;;all;"""Tomar Partido"" ""O Pasquim da Reacção"" ""Blog de Ricardo Noblat"" ""Radar político"" ""Blog do Josias"" ""Dylan Byers on Media"" ""Pragmatismo Político"" ""Blog de Reinaldo Azevedo"" ""Anais Políticos"" ""Blog do Fernando Rodrigues"" ""Blog do Mello"" ""Blogsdepolitica""";"""_ é um blog político"" ""_ é o blog político"" ""é o blog político _"" ""blog político conhecido como _"" ""blog político chamado de _"" ""blog político apelidado de _"" ""_ é um dos blogs políticos"" ""_ são blogs políticos"" ""_ são os blogs políticos"" ""blogs políticos conhecidos como _"" ""blogs políticos chamados de _"" ""blogs políticos apelidados de _"" ""_ são alguns dos blogs políticos"" ""blogs políticos tais como _"" ""blogs políticos assim como _"" ""blogs políticos como _""";;blog político;2014-10-31;Maísa Duarte;Maísa Duarte;A blog substantially and charactarizably, but not exclusively, devoted to politics or political issues.  A general current-events blog such as might be equated with a general newspaper should not be classified as a politicsBlog, although an identifyable subsection or the blog of a particular staff member could be.;;Removed all and added others names;
grupoPolítico;political groups;%s is a {political group};FALSE;FALSE;organizaçãoGeopolítica;;;all;"""PSDB"" ""PT"" ""PSB"" ""PT do B"" ""PMDB"" ""PTB"" ""DEM"" ""PSC"" ""PSTU"" ""PCB""";"""_ é um partido político"" ""_ é o partido político"" ""é o partido político _"" ""partido político conhecido como _"" ""partido político chamado de _"" ""partido político apelidado de _"" ""_ é um dos partidos políticos"" ""_ são partidos políticos"" ""_ são os partidos políticos"" ""partidos políticos conhecidos como _"" ""partidos políticos chamados de _"" ""partidos políticos apelidados de _"" ""_ são alguns dos partidos políticos"" ""partidos políticos tais como _"" ""partidos políticos assim como _"" ""partidos políticos como _""";;grupo político;2014-10-31;Maísa Duarte;Maísa Duarte;Organizations, which may or may not be part of the government, that act in the arenas of politics or government.;;;
questõesPolíticas;Issues;%s is a {political issue};TRUE;TRUE;abstractThing;religião sócioPolítico grupoÉtnico setorEconômico moeda materialDeConstrução livro campoAcadêmico;;all;"""energia"" ""ambiente"" ""segurança"" ""trabalho"" ""moradia"" ""religião"" ""saúde"" ""direitos civis"" ""discriminação"" ""aborto"" ""impostos"" ""controle de armas"" ""política externa"" ""imigração""  ""educação"" ""direitos dos homossexuais"" ""política fiscal""";"""questão política tal como _"" ""questão política assim como _"" ""questão política como a _"" ""_ é uma questão política"" ""_ é a questão política"" ""é a questão política _"" ""questão política conhecida como _"" ""questão política chamada de _"" ""questão política apelidada de _"" ""_ é uma das questões políticas"" ""_ são questões políticas"" ""_ são as questões políticas"" ""questões políticas conhecidas como _"" ""questões políticas chamadas de _"" ""questões políticas apelidadas de _"" ""_ são algumas das questões políticas"" ";;questões políticas;2014-10-31;Maísa Duarte;Maísa Duarte;An issue of political concern;;Translated;
porto;ports;%s is a transportation {port};TRUE;TRUE;atração;transporte;;proper;"""Porto do Açu"" ""Porto de Xangai"" ""Porto de Ningbo e Zhoushan"" ""Porto de Singapura"" ""Porto de Roterdam"" ""Porto de Ilhéus"" ""Porto de Itajaí"" ""Porto de Jaraguá"" ""Porto de Niterói"" ""Porto de Salvador""";"""_ é um porto"" ""_ é o porto"" ""é o porto _"" ""porto conhecido como _"" ""porto chamado de _"" ""porto apelidado de _"" ""_ é um dos portos"" ""_ são portos"" ""_ são os portos"" ""portos conhecidos como _"" ""portos chamados de _"" ""portos apelidados de _"" ""_ são alguns dos portos"" ""portos tais como _"" ""portos assim como _"" ""portos como _""";;porto;2014-10-31;Maísa Duarte;Maísa Duarte;a location on a coast or shore containing one or more harbors where ships can dock and transfer people or cargo to or from land. Port locations are selected to optimize access to land and navigable water, for commercial demand, and for shelter from wind and waves. Ports with deeper water are rarer, but can handle larger, more economical ships. Since ports throughout history handled every kind of traffic, support and storage facilities vary widely, may extend for miles, and dominate the local economy. Some ports have an important, perhaps exclusively military role.;/en/port;Removed all and added brazilian names;
produto;products;%s is a {product};TRUE;TRUE;item;;;proper;" ""Caminhonete"" ""Jaqueta"" ""Computador"" ""Notebook"" ""Colgate"" ""Máquina fotográfica"" ""F250"" ""iPad"" ""Escova de dentes"" ""Cherokee"" ""Honda Fit"" ""iPod"" ""Jeep Cherokee"" ""Jetta"" ""celular"" ""Nintendo Wii"" ""iPhone 5s"" ""Video cassete"" ""Televisão"" ""Xbox 360"" ""Calculadora HP""";"""_ é um produto"" ""_ é o produto"" ""é o produto _"" ""produto conhecido como _"" ""produto chamado de _"" ""produto apelidado de _"" ""_ é um dos produtos"" ""_ são produtos"" ""_ são os produtos"" ""produtos conhecidos como _"" ""produtos chamados de _"" ""produtos apelidados de _"" ""_ são alguns dos produtos"" ""produtos tais como _"" ""produtos assim como _"" ""produtos como _""";;produto;2014-10-31;Maísa Duarte;Maísa Duarte;;none;Removed almost all and added others names;
profissão;professions;%s is a {profession};TRUE;TRUE;abstractThing;cargoPolítico;;common;"""cozinheiros"" ""médicos"" ""advogados"" ""professores"" ""atletas"" ""CEOs"" ""presidentes"" ""vice-presidentes"" ""contadores"" ""faxineiros"" ""engenheiros"" ""zeladores"" ""biólogos"" ""químicos"" ""pilotos""";"""profissão tal como _"" ""profissão assim como _"" ""profissão como a _"" ""_ é uma profissão"" ""_ é a profissão"" ""é a profissão _"" ""profissão conhecida como _"" ""profissão chamada de _"" ""profissão apelidada de _"" ""_ é uma das profissões"" ""_ são profissões"" ""_ são as profissões"" ""profissões conhecidas como _"" ""profissões chamadas de _"" ""profissões apelidadas de _"" ""_ são algumas das profissões"" ";;profissão;2014-10-31;Maísa Duarte;Maísa Duarte;The career or job which a person performs for most of their working life, or for which they are best known (FreeBase);/people/profession;Translated, removed and added few names;
organizaçãoProfissional;professional organizations;%s is a {professional organization};TRUE;TRUE;organização;;;proper;" ""ACM"" ""IEEE"" ""OAB"" ""CREA"" ""Conselho Federal de Administração"" ""CREAS"" ""Confederação Brasileira de Futebol"" ""Conselho Regional de Biblioteconomia"" ""Conselho Federal de Biologia"" ""COFECON""";"""_ é um sindicato"" ""_ é o sindicato"" ""é o sindicato _"" ""sindicato conhecido como _"" ""sindicato chamado de _"" ""sindicato apelidado de _"" ""_ é um dos sindicatos"" ""_ são sindicatos"" ""_ são os sindicatos"" ""sindicatos conhecidos como _"" ""sindicatos chamados de _"" ""sindicatos apelidados de _"" ""_ são alguns dos sindicatos"" ""sindicatos tais como _"" ""sindicatos assim como _"" ""sindicatos como _"" ""_ é um organização profissional"" ""_ é o organização profissional"" ""é o organização profissional _"" ""organização profissional conhecido como _"" ""organização profissional chamado de _"" ""organização profissional apelidado de _"" ""_ é um dos organizações profissionais"" ""_ são organizações profissionais"" ""_ são os organizações profissionais"" ""organizações profissionais conhecidos como _"" ""organizações profissionais chamados de _"" ""organizações profissionais apelidados de _"" ""_ são alguns dos organizações profissionais"" ""organizações profissionais tais como _"" ""organizações profissionais assim como _"" ""organizações profissionais como _"" ""_ é um conselho"" ""_ é o conselho"" ""é o conselho _"" ""conselho conhecido como _"" ""conselho chamado de _"" ""conselho apelidado de _"" ""_ é um dos conselhos"" ""_ são conselhos"" ""_ são os conselhos"" ""conselhos conhecidos como _"" ""conselhos chamados de _"" ""conselhos apelidados de _"" ""_ são alguns dos conselhos"" ""conselhos tais como _"" ""conselhos assim como _"" ""conselhos como _""";;organização profissional;2014-10-31;Maísa Duarte;Maísa Duarte;A professional organization is an organization of people who work in a particular field.;;Removed all and added others names;
professor;professor;%s is a {professor};TRUE;TRUE;pessoa;diretorDeCinema pessoaPorLocalidade arquiteto astronauta escritor artistaDeArteVisual cientista político músico autorDeAM masculino jornalista feminino treinador diretorExecutivo celebridade ator;"""Ivete Sangalo"" ""Lula"" ""Luciano Huck"" ""Bill Gates"" ""Rita Lee""";proper;"""Maria do Carmo Nicoletti"" ""Sérgio Mascarenhas"" ""Estevam Hruschka"" ""Heloisa Camargo"" ""Tadao Murata"" ""Tom Mitchell"" ""Stuart Russel"" ""Peter Norvig"" ""Zilda Arns Neumann"" ""Pasquale"" "" Sérgio Nogueira"" ""Jorge Kalil"" ""Oliver Williamson"" ""John von Neumann"" ""Mascarenhas"" ""César Marcondes""";"""Professor de português _"" ""Professor de matemática _"" ""Professor de computação _"" ""_ professor da universidade"" ""professor de história _"" ""professor de inglês _"" ""Prof. Msc. _"" ""Prof. _"" ""Prof. Dr. _ "" ""Currículo Lattes do professor _"" ""_ é ex-professor"" ""_ é professor-associado"" ""_ possui mestrado"" ""_ cursou mestrado"" "" _ possui doutorado"" ""_ cursou doutorado"" ""_ cursou pós-doc"" ""_ tem pós-doc"" ""_ é professor assistente"" ""_ é um professor"" ""_ é o professor"" ""é o professor _"" ""professor conhecido como _"" ""professor chamado de _"" ""professor apelidado de _"" ""_ é um dos professores"" ""_ são professores"" ""_ são os professores"" ""_ são alguns dos professores"" ""professores tais como _"" ""professores assim como _"" ""professores como _"" ""professora tal como _"" ""professora assim como _"" ""professora como a _"" ""_ é uma professora"" ""_ é a professora"" ""é a professora _"" ""professora conhecida como _"" ""professora chamada de _"" ""professora apelidada de _"" ""_ é uma das professoras"" ""_ são professoras"" ""_ são as professoras"" ""_ são algumas das professoras"" ";;professor;2014-10-31;Maísa Duarte;Maísa Duarte;"""A faculty member at a university or college""";none;Removed all and added others names;
linguagemDeProgramação;programming languages;%s is a {programming language};TRUE;TRUE;abstractThing;;;common;" ""C++"" ""java"" ""Python"" ""perl"" ""LISP"" ""PHP"" ""erlang"" ""scheme"" ""FORTRAN"" ""javascript"" ""Turbo Pascal"" ""COBOL""";"""linguagem de programação tal como _"" ""linguagem de programação assim como _"" ""linguagem de programação como a _"" ""_ é uma linguagem de programação"" ""_ é a linguagem de programação"" ""é a linguagem de programação _"" ""linguagem de programação conhecida como _"" ""linguagem de programação chamada de _"" ""linguagem de programação apelidada de _"" ""_ é uma das linguagens de programação"" ""_ são linguagens de programação"" ""_ são as linguagens de programação"" ""linguagens de programação conhecidas como _"" ""linguagens de programação chamadas de _"" ""linguagens de programação apelidadas de _"" ""_ são algumas das linguagens de programação"" ";;linguagem de programação;2014-10-31;Maísa Duarte;Maísa Duarte;A language used to give instructions to a computer;/computer/programming_language;No changes;
proteína;proteins;%s is a {protein};TRUE;TRUE;abstractThing;;;all;" ""insulina "" ""lisozima "" ""mioglobina "" ""b -lactoglobulina"" ""hemoglobina "" ""tripofano-sintetase"" ""glicogênio-fosforilase"" ""glutamina-sintetase"" ""queratina"" ""melanina"" ""citocina"" ""miosina"" ""actina"" ""dineína citoplasmática"" ""fibrinogênio""";"""proteina tal como _"" ""proteina assim como _"" ""proteina como a _"" ""_ é uma proteina"" ""_ é a proteina"" ""é a proteina _"" ""proteina conhecida como _"" ""proteina chamada de _"" ""proteina apelidada de _"" ""_ é uma das proteinas"" ""_ são proteinas"" ""_ são as proteinas"" ""proteinas conhecidas como _"" ""proteinas chamadas de _"" ""proteinas apelidadas de _"" ""_ são algumas das proteinas"" ";;proteína;2014-10-31;Maísa Duarte;Maísa Duarte;Proteins are any complex organic compounds that consist of one or more chains of amino acids. Proteins are typically essential components of any living cell and indispensable to the proper functioning of all organisms.;/biology/protein;Removed all and added others names;
publicação;publications;%s is a {publication};TRUE;TRUE;empresaDeMídia;;;proper;" ""Alice no País das Maravilhas"" ""Estadão"" ""Tititi"" ""Super Interessante"" ""Jornal A Cidade"" ""Capricho"" ""Revista Auto Esporte"" ""ISTOÉ"" ""Jornal A Tribuna"" ""Jornal Economia e Finanças"" ""Wall Street"" ""Diário de São Paulo"" ""Diário Oficial"" ""Revista INFO"" ""Circulô""";"""publicação tal como _"" ""publicação assim como _"" ""publicação como a _"" ""_ é uma publicação"" ""_ é a publicação"" ""é a publicação _"" ""publicação conhecida como _"" ""publicação chamada de _"" ""publicação apelidada de _"" ""_ é uma das publicações"" ""_ são publicações"" ""_ são as publicações"" ""publicações conhecidas como _"" ""publicações chamadas de _"" ""publicações apelidadas de _"" ""_ são algumas das publicações"" ";;publicação;2014-10-31;Maísa Duarte;Maísa Duarte;;;Removed all and added others names;
corrida;races;%s is a {sports race};TRUE;TRUE;eventoEsportista;;;proper;" ""Grande Prêmio Derby Paulista"" ""Grande Prêmio Diana"" ""Grande Prêmio Cruzeiro do Sul"" ""Indy 500"" ""Corrida de São Silvestre"" ""Marathon Bike Show"" ""Volta Ciclística de São Paulo"" ""Descida das Escadas de Santos"" ""Corrida Ecológica de Campo Largo"" ""Fórmula Truck"" ""Circuito de Corridas CAIXA"" ""Stock Car"" ""Corrida Pela Paz""";"""corrida tal como _"" ""corrida assim como _"" ""corrida como a _"" ""_ é uma corrida"" ""_ é a corrida"" ""é a corrida _"" ""corrida conhecida como _"" ""corrida chamada de _"" ""corrida apelidada de _"" ""_ é uma das corridas"" ""_ são corridas"" ""_ são as corridas"" ""corridas conhecidas como _"" ""corridas chamadas de _"" ""corridas apelidadas de _"" ""_ são algumas das corridas"" ";;corrida;2014-10-31;Maísa Duarte;Maísa Duarte;A sport race is a competition of speed, against an objective criterion, usually a clock or to a specific point. The competitors in a race try to complete a given task in the shortest amount of time. Typically this involves traversing some distance, but it can be any other task involving speed to reach a specific goal. ;none;Removed all and added others names;
estaçãoDeRádio;radio stations;%s is a {radio station};TRUE;TRUE;empresaDeMídia geolocalização;;;proper;" ""Clube FM"" ""Difusora FM"" ""Transamérica"" ""Jovem Pan"" ""Rádio Malibu"" ""Rádio Globo"" ""Rádio Bandeirantes"" ""Band FM"" "" Radio Bristol"" ""Rádio UOL"" ""MIX FM"" ""93 FM"" ""Tupi FM"" ""Nativa FM"" ""Rádio CBN""";"""estação de rádio tal como _"" ""estação de rádio assim como _"" ""estação de rádio como a _"" ""_ é uma estação de rádio"" ""_ é a estação de rádio"" ""é a estação de rádio _"" ""estação de rádio conhecida como _"" ""estação de rádio chamada de _"" ""estação de rádio apelidada de _"" ""_ é uma das estações de rádio"" ""_ são estações de rádio"" ""_ são as estações de rádio"" ""estações de rádio conhecidas como _"" ""estações de rádio chamadas de _"" ""estações de rádio apelidadas de _"" ""_ são algumas das estações de rádio"" ";;estação de rádio;2014-10-31;Maísa Duarte;Maísa Duarte;A radio station is a broadcaster which transmits audio. This category includes broadcast radio, satellite radio and internet radio stations.;/broadcast/radio_station;Removed all and added others names;
receita;recipes;%s is  a {recipe};TRUE;TRUE;abstractThing;;;common;"""Macarrão Alho e Óleo"" ""Receita de Purê de Batatas"" ""Sopa de Legumes"" ""Ensopado polonês"" ""Feijoada"" ""Feijão Tropeiro"" ""Sopa de Fubá"" ""Vatapá"" ""Arroz de Chuxá"" ""Sopa de Legumes""";"""receita tal como _"" ""receita assim como _"" ""receita como a _"" ""_ é uma receita"" ""_ é a receita"" ""é a receita _"" ""receita conhecida como _"" ""receita chamada de _"" ""receita apelidada de _"" ""_ é uma das receitas"" ""_ são receitas"" ""_ são as receitas"" ""receitas conhecidas como _"" ""receitas chamadas de _"" ""receitas apelidadas de _"" ""_ são algumas das receitas"" ";;receita;2014-10-31;Maísa Duarte;Maísa Duarte;A recipe is a method of preparing a dish.  Dishes may have multiple recipes.  For instance, there may be many different recipes for chocolate chip cookies.;/food/recipe;;
gravadora;record labels;%s is a {record label};TRUE;TRUE;empresaDeMídia;;;proper;" ""Acari Records"" ""EMI Music Brasil"" ""Sony Music Brasil"" ""Indie Records"" ""Gravadora Eldorado"" ""EMI"" ""Universal Music"" ""Sony BMG"" ""Warner Music"" ""WEA"" ""Polydor Records"" ""Som Livre"" ""Def Jam Recordings"" ""ArtMix"" ""Gravadora Novo Tempo""";"""gravadora tal como _"" ""gravadora assim como _"" ""gravadora como a _"" ""_ é uma gravadora"" ""_ é a gravadora"" ""é a gravadora _"" ""gravadora conhecida como _"" ""gravadora chamada de _"" ""gravadora apelidada de _"" ""_ é uma das gravadoras"" ""_ são gravadoras"" ""_ são as gravadoras"" ""gravadoras conhecidas como _"" ""gravadoras chamadas de _"" ""gravadoras apelidadas de _"" ""_ são algumas das gravadoras"" ";;gravadora;2014-10-31;Maísa Duarte;Maísa Duarte;A record label is a company that releases music albums.;/music/record_label;Removed all and added others names;
religião;religions;%s is a {religion};TRUE;TRUE;abstractThing;questõesPolíticas;;proper;"""Catolicismo"" ""Islamismo"" ""Espiritismo"" ""Testemunha de Jeová"" ""Mormonismo"" ""Taoísmo"" ""Protestantismo"" ""Cristianismo"" ""Hinduísmo"" ""Budismo""";"""religião tal como _"" ""religião assim como _"" ""religião como a _"" ""_ é uma religião"" ""_ é a religião"" ""é a religião _"" ""religião conhecida como _"" ""religião chamada de _"" ""religião apelidada de _"" ""_ é uma das religiões"" ""_ são religiões"" ""_ são as religiões"" ""religiões conhecidas como _"" ""religiões chamadas de _"" ""religiões apelidadas de _"" ""_ são algumas das religiões"" ";;religião;2014-10-31;Maísa Duarte;Maísa Duarte;Religious sects, denominations, and (meta-)organizations. NOT church buildings or individual chapters/institutions.;/religion/religion;Translated, removed and added few names;
réptil;reptiles;%s is a {reptile};TRUE;TRUE;vertebrado;;;common;"""jacarés"" ""largatiu"" ""camaleões"" ""cobras"" ""cágados"" ""tartarugas"" ""crocodilos"" ""cascavéis"" ""iguanas"" ""lagartos"" ""pythons"" ""jibóias"" ""víboras"" ""lagartixas"" ""tartaruga-verde""";"""_ é um réptil"" ""_ é o réptil"" ""é o réptil _"" ""réptil conhecido como _"" ""réptil chamado de _"" ""réptil apelidado de _"" ""_ é um dos répteis"" ""_ são répteis"" ""_ são os répteis"" ""répteis conhecidos como _"" ""répteis chamados de _"" ""répteis apelidados de _"" ""_ são alguns dos répteis"" ""répteis tais como _"" ""répteis assim como _"" ""répteis como _""";;réptil;2014-10-31;Maísa Duarte;Maísa Duarte;Reptiles are animals in the (Linnaean) class Reptilia. They are characterized by breathing air, laying tough-shelled amniotic eggs, and having skin covered in scales and/or scutes.;none;Translated, removed and added few names;
